{"$comment":"Owning contract: contracts/approval-intent.schema.json per ROADMAP.md §0.4, Paper IV §6.6. Approval intent — the exact consequential action awaiting the operator (glossary: Approval intent). DRAFT 0.1 — built 2026-10-21 on HgX's order; awaiting ratification. Normative on ratification only.","$id":"https://jarvis-estate/contracts/approval-intent.schema.json","$schema":"http://json-schema.org/draft-07/schema#","additionalProperties":false,"properties":{"action":{"description":"Exact action (e.g. send, publish, purchase, delete). Glossary: Consequential action","type":"string"},"approval_state":{"description":"Lifecycle state of this intent (TLA+ ApprovalStates). The intent record itself does not carry this in the machine; included for serialised intent views","enum":["none","requested","tapped","recorded","denied","expired"],"type":"string"},"effect":{"description":"Exact effect to be produced","type":"string"},"expiry":{"description":"Intent expiry in server epoch seconds. T9 guard requires now < expiry; T10 fires at now >= expiry. INTERPRETATION: epoch-seconds integer (matches the machine's guards); Appendix C.2 sketch names this field 'expires_at' as a date-time string — recorded as an open question in BUILD-NOTES.md","minimum":0,"type":"integer"},"intent_digest":{"description":"SHA-256 over the canonical JSON serialisation of the bound fields (glossary U-1, RESOLVED 2026-10-19). See spec/approval-digest.md. Recomputed by the server at decision time; any mutation fails the match (INV-A3, PO-3)","pattern":"^[0-9a-f]{64}$","type":"string"},"intent_id":{"description":"Unique intent identifier (glossary: Approval intent)","type":"string"},"requested_at":{"description":"When the intent was presented to the operator (Paper IV App. C.2)","format":"date-time","type":"string"},"revision":{"description":"Intent revision; binds to the work-item revision (INV-A2). Any change invalidates the intent (INV-A3). INTERPRETATION: integer (TLA+ Nat); Appendix C.2 sketch says string — recorded as an open question in BUILD-NOTES.md","minimum":0,"type":"integer"},"risk_class":{"description":"Risk class (Paper IV App. C.2)","enum":["standard","high","irreversible"],"type":"string"},"scope":{"description":"Bounds of the authorisation","type":"string"},"target":{"description":"Exact target of the action","type":"string"},"work_id":{"description":"Work item this intent belongs to","type":"string"}},"required":["intent_id","work_id","action","target","effect","scope","revision","expiry","intent_digest"],"title":"ApprovalIntent","type":"object","version":"0.1-draft"}